{
  "schemaVersion": 1,
  "catalogId": "myputnam-content-v1",
  "catalogRevision": "edaf95a88341db7ac4a4066681c9a1691f42f623a9a3cb0c8d5996d579ff30e1",
  "generatedAt": "2026-10-20T00:00:00.000Z",
  "minAppVersionCode": 1,
  "includedSets": [
    { "collectionId": "putnam", "setId": "2020" },
    { "collectionId": "putnam", "setId": "2021" },
    { "collectionId": "putnam", "setId": "2022" },
    { "collectionId": "putnam", "setId": "2023" },
    { "collectionId": "putnam", "setId": "2024" },
    { "collectionId": "putnam", "setId": "2025" }
  ],
  "includedReferenceCategories": [
    "algebra-inequalities",
    "sequences-series-recurrences",
    "trigonometry",
    "geometry-vectors",
    "complex-numbers",
    "number-theory",
    "combinatorics-generating-functions",
    "calculus",
    "linear-algebra",
    "probability",
    "differential-equations",
    "laplace-fourier-transforms"
  ]
}
